id	text	property	subject	object
219	Ravza Kavakçı Kan (born 30 March 1972, İstanbul) is Turkish politician, who was elected as a Justice and Development Party deputy for Istanbul 	http://dbpedia.org/ontology/residence	http://dbpedia.org/resource/Ravza_Kavakçı_Kan	http://dbpedia.org/resource/Istanbul
220	Mukund Lal Agrawal (born 16 January 1902 - date of death unknown) was Member of Parliament in the first Lok Sabha from Pilibhit Constituency	http://dbpedia.org/ontology/residence	http://dbpedia.org/resource/Mukund_Lal_Agrawal	http://dbpedia.org/resource/Pilibhit
221	Lal, a prominent sahukar and social worker in the city of Pilibhit	http://dbpedia.org/ontology/residence	http://dbpedia.org/resource/Mukund_Lal_Agrawal	http://dbpedia.org/resource/Pilibhit
222	Saldivar has represented the Belmopan	http://dbpedia.org/ontology/residence	http://dbpedia.org/resource/John_Saldivar_(politician)	http://dbpedia.org/resource/Belmopan
223	Carson Ross (born December 15, 1946) is the mayor of Blue Springs, Missouri	http://dbpedia.org/ontology/residence	http://dbpedia.org/resource/Carson_Ross	http://dbpedia.org/resource/Blue_Springs,_Missouri
224	Fullilove, who graduated from Crenshaw High School in Los Angeles in 1976, currently resides in Burbank, California	http://dbpedia.org/ontology/residence	http://dbpedia.org/resource/Donald_Fullilove	http://dbpedia.org/resource/Burbank,_California
225	Doug Elniski is a Canadian politician and was a Member of the Legislative Assembly of Alberta representing the constituency of Edmonton-Calder	http://dbpedia.org/ontology/residence	http://dbpedia.org/resource/Doug_Elniski	http://dbpedia.org/resource/Edmonton
226	Heather Klimchuk (born August 10, 1958) is a Canadian politician who was a member of the Legislative Assembly of Alberta representing the constituency of Edmonton-Glenora	http://dbpedia.org/ontology/residence	http://dbpedia.org/resource/Heather_Klimchuk	http://dbpedia.org/resource/Edmonton
227	Raj" Sherman (born 1965) is an Alberta politician and former Liberal Member of the Legislative Assembly of Alberta for Edmonton-Meadowlark	http://dbpedia.org/ontology/residence	http://dbpedia.org/resource/Raj_Sherman	http://dbpedia.org/resource/Edmonton
228	Carolene R. Mays was appointed by Indiana Governor Mitch Daniels as a Commissioner for the Indiana Utility Regulatory Commission in February, 2010.From 1998, until the appointment, she was Publisher and President of the Indianapolis Recorder	http://dbpedia.org/ontology/residence	http://dbpedia.org/resource/Carolene_Mays	http://dbpedia.org/resource/Indianapolis
229	Charles Siedler (May 24, 1839 in Münden, Germany – June 28, 1921 in Bloomfield, New Jersey) was the 20th Mayor of Jersey City, New Jersey	http://dbpedia.org/ontology/residence	http://dbpedia.org/resource/Charles_Siedler	http://dbpedia.org/resource/Jersey_City,_New_Jersey
230	Martiny was initially elected to the House in a special election held on May 21, 1994, when the Republican incumbent, Kernan "Skip" Hand (born 1945) of Kenner, Louisiana	http://dbpedia.org/ontology/residence	http://dbpedia.org/resource/Danny_Martiny	http://dbpedia.org/resource/Kenner,_Louisiana
231	Tunde Bakare of the Latter Rain Assembly, Lagos	http://dbpedia.org/ontology/residence	http://dbpedia.org/resource/Tunde_Bakare	http://dbpedia.org/resource/Lagos
232	Gray is a lawyer and politician and game maker of Monopoly For 30 years who has been mayor of Lancaster, Pennsylvania	http://dbpedia.org/ontology/residence	http://dbpedia.org/resource/Rick_Gray	http://dbpedia.org/resource/Lancaster,_Pennsylvania
233	Stanley Jennings Carpenter, Colonel, U.S. Army, retired, deceased, a noted medical Entomologist (See: Medical entomology), was born December 9, 1904 in West Liberty, Morgan County, Kentucky, and died after an extended illness on August 28, 1984 at Santa Rosa, California	http://dbpedia.org/ontology/residence	http://dbpedia.org/resource/Stanley_Jennings_Carpenter	http://dbpedia.org/resource/Santa_Rosa,_California
234	Peynado was educated in Santo Domingo	http://dbpedia.org/ontology/residence	http://dbpedia.org/resource/Jacinto_Peynado	http://dbpedia.org/resource/Santo_Domingo
235	Peynado was educated in Santo Domingo as a lawyer and worked as a law professor at University of Santo Domingo	http://dbpedia.org/ontology/residence	http://dbpedia.org/resource/Jacinto_Peynado	http://dbpedia.org/resource/Santo_Domingo
236	Steve Luecke is the former mayor of South Bend, Indiana	http://dbpedia.org/ontology/residence	http://dbpedia.org/resource/Steve_Luecke	http://dbpedia.org/resource/South_Bend,_Indiana
237	McCurdy was born in Halifax in 1950, and grew up in St. John's, Newfoundland and Labrador	http://dbpedia.org/ontology/residence	http://dbpedia.org/resource/Earle_McCurdy	http://dbpedia.org/resource/St._John's,_Newfoundland_and_Labrador
238	Alicia Llanos de Ramos is the spouse of Jorge Ramos Hernández, the current Municipal president of Tijuana	http://dbpedia.org/ontology/residence	http://dbpedia.org/resource/Alicia_Llanos_de_Ramos	http://dbpedia.org/resource/Tijuana
239	Micklethwaite specialized in outside views and landscapes, as well as architectural and commercial photography, and he was one of Toronto	http://dbpedia.org/ontology/residence	http://dbpedia.org/resource/F._W._Micklethwaite	http://dbpedia.org/resource/Toronto
240	of Elisa Lam, also known by her Cantonese name, Lam Ho Yi (simplified Chinese: 蓝可儿; traditional Chinese: 藍可兒; April 30, 1991 – 2013), a 21-year-old Canadian student at the University of British Columbia in Vancouver	http://dbpedia.org/ontology/residence	http://dbpedia.org/resource/Death_of_Elisa_Lam	http://dbpedia.org/resource/Vancouver
241	Barzaga, Jr. (born March 25, 1950 in Dasmariñas	http://dbpedia.org/ontology/residence	http://dbpedia.org/resource/Elpidio_Barzaga,_Jr.	http://dbpedia.org/resource/Dasmariñas
242	John Weisbeck is a former Canadian politician, who served as a BC Liberal Member of the Legislative Assembly of British Columbia from 1996 to 2005, representing the riding of Kelowna-Lake Country	http://dbpedia.org/ontology/residence	http://dbpedia.org/resource/John_Weisbeck	http://dbpedia.org/resource/Kelowna
243	Steve Thomson (born 1951 or 1952) is a Canadian politician, who was elected as a BC Liberal Member of the Legislative Assembly of British Columbia in the 2009 provincial election, representing the riding of Kelowna-Mission	http://dbpedia.org/ontology/residence	http://dbpedia.org/resource/Steve_Thomson_(politician)	http://dbpedia.org/resource/Kelowna
244	Rais Ansari (or Rayees Ansari) is a famous Urdu poet from Lucknow	http://dbpedia.org/ontology/residence	http://dbpedia.org/resource/Rais_Ansari	http://dbpedia.org/resource/Lucknow
245	Messmer ran in the new district of Okanagan-Penticton	http://dbpedia.org/ontology/residence	http://dbpedia.org/resource/Ivan_Messmer	http://dbpedia.org/resource/Penticton
246	Messmer served six years as mayor of Penticton	http://dbpedia.org/ontology/residence	http://dbpedia.org/resource/Ivan_Messmer	http://dbpedia.org/resource/Penticton
247	Karn Manhas is a Canadian businessman, entrepreneur and a former politician, who served as a BC Liberal Member of the Legislative Assembly of British Columbia from 2001 to 2005, representing the riding of Port Coquitlam-Burke Mountain	http://dbpedia.org/ontology/residence	http://dbpedia.org/resource/Karn_Manhas	http://dbpedia.org/resource/Port_Coquitlam
248	Mohammad Reza Akhlaghpasand (Persian:  محمدرضا اخلاق پسند‎‎, born 12 December 1978 in Rasht	http://dbpedia.org/ontology/residence	http://dbpedia.org/resource/Mohammad_Reza_Akhlaghpasand	http://dbpedia.org/resource/Rasht
249	Jean Perrault (born May 28, 1945), is a Canadian politician, who served as mayor of Sherbrooke	http://dbpedia.org/ontology/residence	http://dbpedia.org/resource/Jean_Perrault	http://dbpedia.org/resource/Sherbrooke
250	Mark Joseph Meredith (born 21 August 1965 in Shelton, Stoke-on-Trent	http://dbpedia.org/ontology/residence	http://dbpedia.org/resource/Mark_Meredith	http://dbpedia.org/resource/Stoke-on-Trent
251	Carlos Mouriño Atanes (born March 4, 1943 in Vigo, Spain) is a Spanish-Mexican businessman and President of Spanish football club Celta de Vigo	http://dbpedia.org/ontology/residence	http://dbpedia.org/resource/Carlos_Mouriño	http://dbpedia.org/resource/Vigo
252	Kyle Norman Fawcett (born November 23, 1979) is a Canadian politician and former Member of the Legislative Assembly of Alberta, representing the constituency of Calgary-Klein	http://dbpedia.org/ontology/residence	http://dbpedia.org/resource/Kyle_Fawcett	http://dbpedia.org/resource/Calgary
253	Halsey-Brandt returned to Richmond, British Columbia City Council	http://dbpedia.org/ontology/residence	http://dbpedia.org/resource/Greg_Halsey-Brandt	http://dbpedia.org/resource/Richmond,_British_Columbia
254	Harish Kumar Gangawar was son of Shri Baldev Prasad Gangwar, who was Agriculturist by profession in Teolia Village, comes under limits of Bareilly	http://dbpedia.org/ontology/residence	http://dbpedia.org/resource/Harish_Kumar_Gangawar	http://dbpedia.org/resource/Bareilly
255	Chantal Rouleau is a city councillor from Montreal	http://dbpedia.org/ontology/residence	http://dbpedia.org/resource/Chantal_Rouleau	http://dbpedia.org/resource/Montreal
256	Gilles Deguire was a city councillor from Montreal	http://dbpedia.org/ontology/residence	http://dbpedia.org/resource/Gilles_Deguire	http://dbpedia.org/resource/Montreal
257	Luc Ferrandez from Montreal, Quebec, Canada, is the interim leader of Montreal municipal party, Projet Montreal	http://dbpedia.org/ontology/residence	http://dbpedia.org/resource/Luc_Ferrandez	http://dbpedia.org/resource/Montreal
258	Manon Barbe is a city councillor from Montreal	http://dbpedia.org/ontology/residence	http://dbpedia.org/resource/Manon_Barbe	http://dbpedia.org/resource/Montreal
259	Marie Cinq-Mars is a city councillor from Montreal	http://dbpedia.org/ontology/residence	http://dbpedia.org/resource/Marie_Cinq-Mars	http://dbpedia.org/resource/Montreal
260	Pierre Gagnier is a city councillor from Montreal	http://dbpedia.org/ontology/residence	http://dbpedia.org/resource/Pierre_Gagnier	http://dbpedia.org/resource/Montreal
261	Richard Bélanger was a city councillor from Montreal	http://dbpedia.org/ontology/residence	http://dbpedia.org/resource/Richard_Bélanger	http://dbpedia.org/resource/Montreal
262	Pedram Javaheri also known as "P.J. Javaheri" (born May 24, 1983) is an Iranian-American meteorologist for CNN International based at the CNN World Headquarters in Atlanta	http://dbpedia.org/ontology/residence	http://dbpedia.org/resource/Pedram_Javaheri	http://dbpedia.org/resource/Atlanta
263	Bill Granger (June 1, 1941 – April 22, 2012) was an American novelist from Chicago	http://dbpedia.org/ontology/residence	http://dbpedia.org/resource/Bill_Granger_(author)	http://dbpedia.org/resource/Chicago
264	Stroth serves as the business advisor and legal contact for athletes from teams such as the Washington Redskins, Chicago Bears	http://dbpedia.org/ontology/residence	http://dbpedia.org/resource/Andrew_Stroth	http://dbpedia.org/resource/Chicago
