id	text	property	subject	object
335	Han Sai Por (simplified Chinese: 韩少芙; traditional Chinese: 韓少芙; pinyin: Hán Shào Fú; born 19 July 1943) is a Singaporean	http://dbpedia.org/ontology/nationality	http://dbpedia.org/resource/Han_Sai_Por	http://dbpedia.org/resource/Singapore
336	Max Penson (1893–1959) was a noted Russian photojournalist and photographer of the Soviet Union	http://dbpedia.org/ontology/nationality	http://dbpedia.org/resource/Max_Penson	http://dbpedia.org/resource/Soviet_Union
337	Daniel García Andújar (1966 in Almoradí) is a visual media artist, activist and art theorist from Spain	http://dbpedia.org/ontology/nationality	http://dbpedia.org/resource/Daniel_García_Andújar	http://dbpedia.org/resource/Spain
338	Chandima Weerakkody MP (23 May 1968) is Sri Lanka's Cabinet Minister of Petroleum & Petroleum Gas in 15th Parliament of Sri Lanka	http://dbpedia.org/ontology/nationality	http://dbpedia.org/resource/Chandima_Weerakkody	http://dbpedia.org/resource/Sri_Lanka
339	Lalith Chandrakumar Weeratunga (Sinhala: ලලිත් වීරතුංග) (known as Lalith Weeratunga), (born 14 May 1950) SLAS, is the former Permanent Secretary to the President of Sri Lanka	http://dbpedia.org/ontology/nationality	http://dbpedia.org/resource/Lalith_Weeratunga	http://dbpedia.org/resource/Sri_Lanka
340	Maithripala Yapa Sirisena (pronounced [pallewat̪t̪ə ɡaməraːləlaːɡeː majt̪ɾiːpaːlə jaːpaː siɾiseːnə]; known as Maithripala Sirisena or also referred to as "Maithri"; Sinhalese: මෛත්‍රිපාල සිරිසේන; Tamil: மைத்திரிபால சிறிசேன; born 3 September 1951) is a Sri Lankan	http://dbpedia.org/ontology/nationality	http://dbpedia.org/resource/Maithripala_Sirisena	http://dbpedia.org/resource/Sri_Lanka
341	Sirisena joined mainstream politics in 1989 as a member of the Parliament of Sri Lanka	http://dbpedia.org/ontology/nationality	http://dbpedia.org/resource/Maithripala_Sirisena	http://dbpedia.org/resource/Sri_Lanka
342	Maithripala Yapa Sirisena (pronounced [pallewat̪t̪ə ɡaməraːləlaːɡeː majt̪ɾiːpaːlə jaːpaː siɾiseːnə]; known as Maithripala Sirisena or also referred to as "Maithri"; Sinhalese: මෛත්‍රිපාල සිරිසේන; Tamil: மைத்திரிபால சிறிசேன; born 3 September 1951) is a Sri Lankan politician who is the 7th and current President of Sri Lanka	http://dbpedia.org/ontology/nationality	http://dbpedia.org/resource/Maithripala_Sirisena	http://dbpedia.org/resource/Sri_Lanka
343	Palitha Range Bandara (born September 8, 1962) is a Sri Lankan politician and a member of the Parliament of Sri Lanka	http://dbpedia.org/ontology/nationality	http://dbpedia.org/resource/Palitha_Range_Bandara	http://dbpedia.org/resource/Sri_Lanka
344	Karunanayake, MP (born 19 February 1963) is a Sri Lankan	http://dbpedia.org/ontology/nationality	http://dbpedia.org/resource/Ravi_Karunanayake	http://dbpedia.org/resource/Sri_Lanka
345	Rishad Bathiudeen is a Sri Lankan politician, a member of the Parliament of Sri Lanka	http://dbpedia.org/ontology/nationality	http://dbpedia.org/resource/Rishad_Bathiudeen	http://dbpedia.org/resource/Sri_Lanka
346	Rishad Bathiudeen holds a National Diploma in Technology (NDT) in Civil Engineering from the University of Moratuwa, Sri Lanka	http://dbpedia.org/ontology/nationality	http://dbpedia.org/resource/Rishad_Bathiudeen	http://dbpedia.org/resource/Sri_Lanka
347	Nawinne (born 24 February 1946) is a member of United National Party and a member of the Parliament of Sri Lanka	http://dbpedia.org/ontology/nationality	http://dbpedia.org/resource/S._B._Nawinne	http://dbpedia.org/resource/Sri_Lanka
348	Premadasa the former President of Sri Lanka	http://dbpedia.org/ontology/nationality	http://dbpedia.org/resource/Sajith_Premadasa	http://dbpedia.org/resource/Sri_Lanka
349	Sajith Premadasa (Sinhala : සජිත් ප්‍රේමදාස, Tamil : சஜித் பிரேமதாச) (born 12 January 1967) is a Sri Lankan	http://dbpedia.org/ontology/nationality	http://dbpedia.org/resource/Sajith_Premadasa	http://dbpedia.org/resource/Sri_Lanka
350	Sanath Rathnayake Weerakoon, is a Sri Lanka	http://dbpedia.org/ontology/nationality	http://dbpedia.org/resource/Sanath_Weerakoon	http://dbpedia.org/resource/Sri_Lanka
351	Sarath Kumara Gunarathne is a Sri Lankan politician, a member of the Parliament of Sri Lanka	http://dbpedia.org/ontology/nationality	http://dbpedia.org/resource/Sarath_Kumara_Gunaratna	http://dbpedia.org/resource/Sri_Lanka
352	Biland now runs Karting events in Switzerland	http://dbpedia.org/ontology/nationality	http://dbpedia.org/resource/Rolf_Biland	http://dbpedia.org/resource/Switzerland
353	Wang Chien-shien (Chinese: 王建煊; pinyin: Wáng Jiànxuān) (born August 7, 1938) is a Taiwanese	http://dbpedia.org/ontology/nationality	http://dbpedia.org/resource/Wang_Chien-shien	http://dbpedia.org/resource/Taiwan
354	Chih-Wei Huang (黃志偉) is a developer and promoter of free software who lives in Taiwan	http://dbpedia.org/ontology/nationality	http://dbpedia.org/resource/Chih-Wei_Huang	http://dbpedia.org/resource/Taiwan
355	Henrik Møller (born 3 September 1985 in Fredericia)  is a Danish motorcycle speedway rider who was a member of Denmark team	http://dbpedia.org/ontology/nationality	http://dbpedia.org/resource/Henrik_Møller	http://dbpedia.org/resource/Denmark
356	Patrick Hald Hougaard (born 23 May 1989) is a Danish motorcycle speedway rider who was a member of Denmark U-21 national team	http://dbpedia.org/ontology/nationality	http://dbpedia.org/resource/Patrick_Hougaard	http://dbpedia.org/resource/Denmark
357	Peter Kildemand (born 1 September 1989) is a Danish motorcycle speedway rider who is a member of Denmark U-21 national teams	http://dbpedia.org/ontology/nationality	http://dbpedia.org/resource/Peter_Kildemand	http://dbpedia.org/resource/Denmark
358	René Bach (born 7 June 1990, in Hjordkaer, Rødekro) is a Danish motorcycle speedway rider who is a member of Denmark U-21 national team	http://dbpedia.org/ontology/nationality	http://dbpedia.org/resource/René_Bach	http://dbpedia.org/resource/Denmark
359	Simon Nielsen (born 1 October 1990) is a Danish motorcycle speedway rider who rode in the Denmark U-19 national team	http://dbpedia.org/ontology/nationality	http://dbpedia.org/resource/Simon_Nielsen_(speedway_rider)	http://dbpedia.org/resource/Denmark
360	Ivana Đerisilo-Stankovic (Serbia	http://dbpedia.org/ontology/nationality	http://dbpedia.org/resource/Ivana_Đerisilo	http://dbpedia.org/resource/Serbia
361	Natalia Yuriivna Korolevska (Ukrainian: Наталія Юріївна Королевська) (born 18 May 1975 in Krasnyi Luch) is a Ukrainian politician and ex-Minister of Social Policy of Ukraine	http://dbpedia.org/ontology/nationality	http://dbpedia.org/resource/Natalia_Korolevska	http://dbpedia.org/resource/Ukraine
362	Oksana Volodymyrivna Bilozir (Ukrainian: Оксана Володимирівна Білозір), née Rozumkevych (Ukrainian: Розумкевич), is a People's Artist of Ukraine (1994), former People's Deputy of Ukraine and in 2005 Minister of Culture and Tourism of Ukraine	http://dbpedia.org/ontology/nationality	http://dbpedia.org/resource/Oksana_Bilozir	http://dbpedia.org/resource/Ukraine
363	Oksana Volodymyrivna Bilozir (Ukrainian: Оксана Володимирівна Білозір), née Rozumkevych (Ukrainian: Розумкевич), is a People's Artist of Ukraine	http://dbpedia.org/ontology/nationality	http://dbpedia.org/resource/Oksana_Bilozir	http://dbpedia.org/resource/Ukraine
364	Oksana Volodymyrivna Bilozir (Ukrainian: Оксана Володимирівна Білозір), née Rozumkevych (Ukrainian: Розумкевич), is a People's Artist of Ukraine (1994), former People's Deputy of Ukraine	http://dbpedia.org/ontology/nationality	http://dbpedia.org/resource/Oksana_Bilozir	http://dbpedia.org/resource/Ukraine
365	Tihipko was Minister of Economics in 2000 and subsequently served as Chairman of the National Bank of Ukraine	http://dbpedia.org/ontology/nationality	http://dbpedia.org/resource/Serhiy_Tihipko	http://dbpedia.org/resource/Ukraine
366	Reinaldo Zavarce Peche (born July 8, 1988 in Caracas, Venezuela) is an award-winning Venezuelan	http://dbpedia.org/ontology/nationality	http://dbpedia.org/resource/Reinaldo_Zavarce	http://dbpedia.org/resource/Venezuela
367	Bencomo won the Miss Lara 2009 (Señorita Centroccidental) title in a state pageant held in Barquisimeto, Venezuela	http://dbpedia.org/ontology/nationality	http://dbpedia.org/resource/Sandrina_Bencomo	http://dbpedia.org/resource/Venezuela
368	Bencomo signed with Elite Model Management in New York, The Fashion Model Management in Italy, Bookings International Model in Venezuela	http://dbpedia.org/ontology/nationality	http://dbpedia.org/resource/Sandrina_Bencomo	http://dbpedia.org/resource/Venezuela
369	Nguyễn Tiến Trung (born in 1983, Hung Ha district, Thai Binh province), is a pro-democracy activist in Vietnam	http://dbpedia.org/ontology/nationality	http://dbpedia.org/resource/Nguyễn_Tiến_Trung	http://dbpedia.org/resource/Vietnam
370	Pedro Pablo Opeka (born June 29, 1948), known also as Father Opeka, is a Catholic priest from Argentina	http://dbpedia.org/ontology/nationality	http://dbpedia.org/resource/Pedro_Opeka	http://dbpedia.org/resource/Argentina
371	Gentry was born in the United States, he represented Canada	http://dbpedia.org/ontology/nationality	http://dbpedia.org/resource/Matt_Gentry	http://dbpedia.org/resource/Canada
372	Campbell was born in Mississauga, Ontario, Canada	http://dbpedia.org/ontology/nationality	http://dbpedia.org/resource/Nikki_Campbell	http://dbpedia.org/resource/Canada
373	Ryan Yip (born December 7, 1984) is a Canadian professional golfer who currently plays on PGA Tour Canada	http://dbpedia.org/ontology/nationality	http://dbpedia.org/resource/Ryan_Yip	http://dbpedia.org/resource/Canada
374	Raimo Pajusalu (born 1 February 1981 in Pärnu) is a retired Estonian	http://dbpedia.org/ontology/nationality	http://dbpedia.org/resource/Raimo_Pajusalu	http://dbpedia.org/resource/Estonia
375	Brigitte Barèges (born May 1, 1953 in Toulouse) is a member of the National Assembly of France	http://dbpedia.org/ontology/nationality	http://dbpedia.org/resource/Brigitte_Barèges	http://dbpedia.org/resource/France
376	Bruce Heard (born March 9, 1957, in Nice, France	http://dbpedia.org/ontology/nationality	http://dbpedia.org/resource/Bruce_Heard	http://dbpedia.org/resource/France
377	Charles de La Verpillière (born May 31, 1954 in Bourg-en-Bresse, Ain) is a member of the National Assembly of France	http://dbpedia.org/ontology/nationality	http://dbpedia.org/resource/Charles_de_la_Verpillière	http://dbpedia.org/resource/France
378	François de Rugy (born 6 December 1973 in Nantes) is a member of the National Assembly of France	http://dbpedia.org/ontology/nationality	http://dbpedia.org/resource/François_de_Rugy	http://dbpedia.org/resource/France
379	Guy Trédaniel is a French publisher who founded in 1974 Editions Guy Trédaniel, a printing company based in Paris, France	http://dbpedia.org/ontology/nationality	http://dbpedia.org/resource/Guy_Trédaniel	http://dbpedia.org/resource/France
380	Philippe Gosselin (born October 23, 1966 in Carentan) is a member of the National Assembly of France	http://dbpedia.org/ontology/nationality	http://dbpedia.org/resource/Philippe_Gosselin	http://dbpedia.org/resource/France
381	Salah "Entertainer" Benlemqawanssa (born June 28, 1979), also known as Spider Salah, is an award-winning competitive hip-hop dancer from France who won the inaugural season of La France a un incroyable talent	http://dbpedia.org/ontology/nationality	http://dbpedia.org/resource/Salah_(dancer)	http://dbpedia.org/resource/France
382	Sophie Joissains (born 25 October 1969) is a French politician and a member of the Senate of France	http://dbpedia.org/ontology/nationality	http://dbpedia.org/resource/Sophie_Joissains	http://dbpedia.org/resource/France
383	Abdulhussain Abdulredha (born 15 July 1939), (Arabic: عبد الحسين عبد الرضا‎‎ 'Abd al-Ḥussain 'Abd ar-Riḍā) is a Kuwaiti	http://dbpedia.org/ontology/nationality	http://dbpedia.org/resource/Abdulhussain_Abdulredha	http://dbpedia.org/resource/Kuwait
384	Hussain Ali Alsayyid Khalifa Hussain al-Qallaf  (Arabic:حسين علي السيد خليفة حسين القلاف) is a member of the Kuwaiti National Assembly	http://dbpedia.org/ontology/nationality	http://dbpedia.org/resource/Hussain_al-Qallaf	http://dbpedia.org/resource/Kuwait
385	Sergio Arturo Castro Martínez (born March 12, 1941) is a Mexican humanitarian who resides in San Cristóbal de las Casas, Chiapas, Mexico	http://dbpedia.org/ontology/nationality	http://dbpedia.org/resource/Sergio_Castro	http://dbpedia.org/resource/Mexico
386	Martin was secretary of the Panania branch of the Australian Labor Party from 1949, and in 1969 was elected to the Australian House of Representatives	http://dbpedia.org/ontology/nationality	http://dbpedia.org/resource/Vince_Martin_(politician)	http://dbpedia.org/resource/Australia
387	Martin was secretary of the Panania branch of the Australian Labor Party	http://dbpedia.org/ontology/nationality	http://dbpedia.org/resource/Vince_Martin_(politician)	http://dbpedia.org/resource/Australia
388	Darcy Stephen Ward (born 4 May 1992 in Nanango, Queensland) is an Australian former motorcycle speedway rider who won the 2009, 2010 and 2011 Australian Under-21 Championships	http://dbpedia.org/ontology/nationality	http://dbpedia.org/resource/Darcy_Ward	http://dbpedia.org/resource/Australia
389	Darcy Stephen Ward (born 4 May 1992 in Nanango, Queensland) is an Australian	http://dbpedia.org/ontology/nationality	http://dbpedia.org/resource/Darcy_Ward	http://dbpedia.org/resource/Australia
390	Doug" Moppett MLC (14 May 1940 – 18 June 2002) is a former Australian	http://dbpedia.org/ontology/nationality	http://dbpedia.org/resource/Doug_Moppett	http://dbpedia.org/resource/Australia
391	Jones won his first title on his home PGA Tour of Australasia, with a victory in the Emirates Australian Open	http://dbpedia.org/ontology/nationality	http://dbpedia.org/resource/Matt_Jones_(golfer)	http://dbpedia.org/resource/Australia
392	Ya'qub Bilbul (Arabic: يعقوب بلبل‎‎, Hebrew: יעקב (בלבול) לב‎‎; also transliterated Jacob Bilbul and Ya'coub Balbul) (1920–2003) was an Iraqi Jewish	http://dbpedia.org/ontology/nationality	http://dbpedia.org/resource/Ya'qub_Bilbul	http://dbpedia.org/resource/Iraq
393	Ya'qub Bilbul (Arabic: يعقوب بلبل‎‎, Hebrew: יעקב (בלבול) לב‎‎; also transliterated Jacob Bilbul and Ya'coub Balbul) (1920–2003) was an Iraq	http://dbpedia.org/ontology/nationality	http://dbpedia.org/resource/Ya'qub_Bilbul	http://dbpedia.org/resource/Iraq
394	de Beer was part of the South African team	http://dbpedia.org/ontology/nationality	http://dbpedia.org/resource/Willem_de_Beer	http://dbpedia.org/resource/South_Africa
395	Grant Haskin (born 1968) is the former Executive Deputy Mayor of Cape Town, where he also served briefly as acting Mayor City of Cape Town, South Africa	http://dbpedia.org/ontology/nationality	http://dbpedia.org/resource/Grant_Haskin	http://dbpedia.org/resource/South_Africa
396	Joe Parker opened Parker's Comedy and Jive, a dedicated venue for stand-up comedy in Johannesburg, South Africa	http://dbpedia.org/ontology/nationality	http://dbpedia.org/resource/Joe_Parker	http://dbpedia.org/resource/South_Africa
397	Mario Gaspare R. Oriani-Ambrosini (October 26, 1960 – August 16, 2014) was an Italian constitutional lawyer and politician who was a Member of Parliament in South Africa	http://dbpedia.org/ontology/nationality	http://dbpedia.org/resource/Mario_Oriani-Ambrosini	http://dbpedia.org/resource/South_Africa
398	Max Price is the vice-chancellor and principal of the University of Cape Town in South Africa	http://dbpedia.org/ontology/nationality	http://dbpedia.org/resource/Max_Price	http://dbpedia.org/resource/South_Africa
399	Miller was arrested by the South African Security Police	http://dbpedia.org/ontology/nationality	http://dbpedia.org/resource/Mel_Miller_(comedian)	http://dbpedia.org/resource/South_Africa
400	Poewe was born in Cape Town, South Africa	http://dbpedia.org/ontology/nationality	http://dbpedia.org/resource/Sarah_Poewe	http://dbpedia.org/resource/South_Africa
