id	text	property	subject	object
216	Olsen's success greatly helped popularize the sport in Denmark which led to him building and opening a track at Vojens, the 15,000 capacity Vojens Speedway Center, which has held many Danish Championships as well as the 1988 and 1994 Speedway World Finals (1994 being the last under the old single meeting format) while it hosted the Speedway Grand Prix of Denmark	http://dbpedia.org/ontology/nationality	http://dbpedia.org/resource/Ole_Olsen_(speedway_rider)	http://dbpedia.org/resource/Denmark
217	Olsen was the captain of Denmark	http://dbpedia.org/ontology/nationality	http://dbpedia.org/resource/Ole_Olsen_(speedway_rider)	http://dbpedia.org/resource/Denmark
218	Ole Olsen (born 16 November 1946 in Haderslev, Denmark	http://dbpedia.org/ontology/nationality	http://dbpedia.org/resource/Ole_Olsen_(speedway_rider)	http://dbpedia.org/resource/Denmark
219	Slobodan Milošević (pronounced [slobǒdan milǒːʃeʋitɕ] (13px listen); Serbian Cyrillic: Слободан Милошевић; 20 August 1941 – 11 March 2006) was a Yugoslav and Serbian politician who was the President of Serbia (originally the Socialist Republic of Serbia	http://dbpedia.org/ontology/nationality	http://dbpedia.org/resource/Slobodan_Milošević	http://dbpedia.org/resource/Serbia
220	Slobodan Milošević (pronounced [slobǒdan milǒːʃeʋitɕ] (13px listen); Serbia	http://dbpedia.org/ontology/nationality	http://dbpedia.org/resource/Slobodan_Milošević	http://dbpedia.org/resource/Serbia
221	John Lyons (born 11 July 1949) is a Labour Party politician in the United Kingdom	http://dbpedia.org/ontology/nationality	http://dbpedia.org/resource/John_Lyons_(British_politician)	http://dbpedia.org/resource/United_Kingdom
222	Linda Perham (born 29 June 1947) is a Labour politician in the United Kingdom	http://dbpedia.org/ontology/nationality	http://dbpedia.org/resource/Linda_Perham	http://dbpedia.org/resource/United_Kingdom
223	Robert Andrew Raymond Syms (born 15 August 1956, [Chippenham ]]) is a Conservative Party politician in the United Kingdom	http://dbpedia.org/ontology/nationality	http://dbpedia.org/resource/Robert_Syms	http://dbpedia.org/resource/United_Kingdom
224	Doucette was born in Winchester, Hampshire but grew up on the Isle of Wight, in the United Kingdom	http://dbpedia.org/ontology/nationality	http://dbpedia.org/resource/Sarah_Doucette	http://dbpedia.org/resource/United_Kingdom
225	Serrana Andrea Fernández la Banca (born November 13, 1973) is an Olympic backstroke swimmer from Uruguay	http://dbpedia.org/ontology/nationality	http://dbpedia.org/resource/Serrana_Fernández	http://dbpedia.org/resource/Uruguay
226	Bhattarai himself at Nepal	http://dbpedia.org/ontology/nationality	http://dbpedia.org/resource/Subin_Bhattarai	http://dbpedia.org/resource/Nepal
227	Duffy is a former strategist for the Liberal Party of Canada	http://dbpedia.org/ontology/nationality	http://dbpedia.org/resource/John_Duffy_(writer)	http://dbpedia.org/resource/Canada
228	Rodolfo A. Falcón Cabrera (born October 25, 1972 in Havana, Cuba	http://dbpedia.org/ontology/nationality	http://dbpedia.org/resource/Rodolfo_Falcón	http://dbpedia.org/resource/Cuba
229	Ivar Karl Ugi (9 September 1930 in Saaremaa, Estonia – 29 September 2005 in Munich) was an Estonian	http://dbpedia.org/ontology/nationality	http://dbpedia.org/resource/Ivar_Karl_Ugi	http://dbpedia.org/resource/Estonia
230	Ivar Karl Ugi (9 September 1930 in Saaremaa, Estonia	http://dbpedia.org/ontology/nationality	http://dbpedia.org/resource/Ivar_Karl_Ugi	http://dbpedia.org/resource/Estonia
231	Isabelle Debré (born 23 May 1957 in Lisieux, Calvados) is a member of the Senate of France	http://dbpedia.org/ontology/nationality	http://dbpedia.org/resource/Isabelle_Debré	http://dbpedia.org/resource/France
232	Raymond Molinier (1904–1994) was a leader of the Trotskyist movement in France	http://dbpedia.org/ontology/nationality	http://dbpedia.org/resource/Raymond_Molinier	http://dbpedia.org/resource/France
233	Mordehai (Moti) Milgrom is an Israel	http://dbpedia.org/ontology/nationality	http://dbpedia.org/resource/Mordehai_Milgrom	http://dbpedia.org/resource/Israel
234	Hugo Hernández (born September 11, 1985 in El Dorado, Sinaloa, Mexico	http://dbpedia.org/ontology/nationality	http://dbpedia.org/resource/Hugo_Hernández	http://dbpedia.org/resource/Mexico
235	Irma Huerta (born August 19, 1969) is a former female freestyle swimmer from Mexico	http://dbpedia.org/ontology/nationality	http://dbpedia.org/resource/Irma_Huerta	http://dbpedia.org/resource/Mexico
236	Gavan Michael O'Connor (born 2 December 1947) is an Australian politician who was an Australian Labor Party (ALP) member of the Australian House of Representatives	http://dbpedia.org/ontology/nationality	http://dbpedia.org/resource/Gavan_O'Connor	http://dbpedia.org/resource/Australia
237	Gavan Michael O'Connor (born 2 December 1947) is an Australian politician who was an Australian Labor Party	http://dbpedia.org/ontology/nationality	http://dbpedia.org/resource/Gavan_O'Connor	http://dbpedia.org/resource/Australia
238	Freeth was born in Angaston, South Australia	http://dbpedia.org/ontology/nationality	http://dbpedia.org/resource/Gordon_Freeth	http://dbpedia.org/resource/Australia
239	Gordon Freeth KBE (6 August 1914 – 27 November 2001) was an Australian	http://dbpedia.org/ontology/nationality	http://dbpedia.org/resource/Gordon_Freeth	http://dbpedia.org/resource/Australia
240	Woods was elected as the Member for Clarence in the New South Wales Legislative Assembly for the Australian Labor Party	http://dbpedia.org/ontology/nationality	http://dbpedia.org/resource/Harry_Woods_(Australian_politician)	http://dbpedia.org/resource/Australia
241	John Cameron McPhee, KCMG (4 July 1878 – 14 September 1952) was an Australian	http://dbpedia.org/ontology/nationality	http://dbpedia.org/resource/John_McPhee_(politician)	http://dbpedia.org/resource/Australia
242	Kelly Joy Hoare (born 1 July 1963), Australian politician, was an Australian Labor Party	http://dbpedia.org/ontology/nationality	http://dbpedia.org/resource/Kelly_Hoare	http://dbpedia.org/resource/Australia
243	Kelly Joy Hoare (born 1 July 1963), Australian politician, was an Australian Labor Party member of the Australian House of Representatives	http://dbpedia.org/ontology/nationality	http://dbpedia.org/resource/Kelly_Hoare	http://dbpedia.org/resource/Australia
244	Peter Laurence Black OAM (born 14 June 1943) is an Australian	http://dbpedia.org/ontology/nationality	http://dbpedia.org/resource/Peter_Black_(Australian_politician)	http://dbpedia.org/resource/Australia
245	Richard Witty Foster (20 August 1856 – 5 January 1932) was an Australian politician, a member of the Parliament of Australia	http://dbpedia.org/ontology/nationality	http://dbpedia.org/resource/Richard_Foster_(Australian_politician)	http://dbpedia.org/resource/Australia
246	Scott Doohan is a Grand Prix motorcycle racer from Australia	http://dbpedia.org/ontology/nationality	http://dbpedia.org/resource/Scott_Doohan	http://dbpedia.org/resource/Australia
247	Williams gained Australian Labor Party (ALP) pre-selection for the Australian House of Representatives electorate of Robertson and defeated sitting United Australia Party	http://dbpedia.org/ontology/nationality	http://dbpedia.org/resource/Thomas_Williams_(Australian_politician)	http://dbpedia.org/resource/Australia
248	Williams held the seat of Robertson until the 1949 federal election, when he was defeated by Liberal Party of Australia	http://dbpedia.org/ontology/nationality	http://dbpedia.org/resource/Thomas_Williams_(Australian_politician)	http://dbpedia.org/resource/Australia
249	Williams gained Australian Labor Party	http://dbpedia.org/ontology/nationality	http://dbpedia.org/resource/Thomas_Williams_(Australian_politician)	http://dbpedia.org/resource/Australia
250	Williams gained Australian Labor Party (ALP) pre-selection for the Australian House of Representatives	http://dbpedia.org/ontology/nationality	http://dbpedia.org/resource/Thomas_Williams_(Australian_politician)	http://dbpedia.org/resource/Australia
251	Pauling was awarded an Officer of the Order of Australia	http://dbpedia.org/ontology/nationality	http://dbpedia.org/resource/Tom_Pauling	http://dbpedia.org/resource/Australia
252	Tom" Pauling, AO, QC (born 13 December 1946) is an Australian	http://dbpedia.org/ontology/nationality	http://dbpedia.org/resource/Tom_Pauling	http://dbpedia.org/resource/Australia
253	Jörgen Persson (born 22 April 1966, in Halmstad, Sweden	http://dbpedia.org/ontology/nationality	http://dbpedia.org/resource/Jörgen_Persson	http://dbpedia.org/resource/Sweden
254	Marie Svensson (born 9 August 1967) is a former female table tennis player from Sweden	http://dbpedia.org/ontology/nationality	http://dbpedia.org/resource/Marie_Svensson	http://dbpedia.org/resource/Sweden
255	Bradley Iles (born 23 August 1983) is a professional golfer from New Zealand	http://dbpedia.org/ontology/nationality	http://dbpedia.org/resource/Bradley_Iles	http://dbpedia.org/resource/New_Zealand
256	Vallyon is a member of the New Zealand Society of Authors	http://dbpedia.org/ontology/nationality	http://dbpedia.org/resource/Imre_Vallyon	http://dbpedia.org/resource/New_Zealand
257	Long was born in Cromwell, New Zealand	http://dbpedia.org/ontology/nationality	http://dbpedia.org/resource/Michael_Long_(golfer)	http://dbpedia.org/resource/New_Zealand
258	Carpenter immigrated to the United States	http://dbpedia.org/ontology/nationality	http://dbpedia.org/resource/William_Carpenter_(flat_Earth_theorist)	http://dbpedia.org/resource/United_States
259	Angie" Akers (née Harris) (born June 30, 1976) is a professional beach volleyball player from the United States	http://dbpedia.org/ontology/nationality	http://dbpedia.org/resource/Angie_Akers	http://dbpedia.org/resource/United_States
260	Kendrick James Farris (born July 2, 1986) is an Olympic weightlifter from the United States	http://dbpedia.org/ontology/nationality	http://dbpedia.org/resource/Kendrick_Farris	http://dbpedia.org/resource/United_States
261	Gentry was born in the United States	http://dbpedia.org/ontology/nationality	http://dbpedia.org/resource/Matt_Gentry	http://dbpedia.org/resource/United_States
262	Gentry was born in the United States	http://dbpedia.org/ontology/nationality	http://dbpedia.org/resource/Matt_Gentry	http://dbpedia.org/resource/United_States
263	Reuben Jeffery III (born August 21, 1953) is the former United States Under Secretary of State for Economic, Business, and Agricultural Affairs, having been appointed to that position by United States President	http://dbpedia.org/ontology/nationality	http://dbpedia.org/resource/Reuben_Jeffery_III	http://dbpedia.org/resource/United_States
264	Rolland Golden studied under regionalist painter and teacher John McCrady in the famed French Quarter of New Orleans after finishing a 4-year stint in the United States Navy	http://dbpedia.org/ontology/nationality	http://dbpedia.org/resource/Rolland_Golden	http://dbpedia.org/resource/United_States
265	Abdul Shakoor Rashad (Pashto: عبدالشکور رشاد‎) was born on November 14, 1921 in Kandahar City, Afghanistan	http://dbpedia.org/ontology/nationality	http://dbpedia.org/resource/Abdul_Shakoor_Rashad	http://dbpedia.org/resource/Afghanistan
266	Hamlet Abdulla oglu Isayev (Azerbaijani	http://dbpedia.org/ontology/nationality	http://dbpedia.org/resource/Hamlet_Isakhanli	http://dbpedia.org/resource/Azerbaijan
267	Hamlet Abdulla oglu Isayev (Azerbaijan	http://dbpedia.org/ontology/nationality	http://dbpedia.org/resource/Hamlet_Isakhanli	http://dbpedia.org/resource/Azerbaijan
268	Emly Starr (born 5 September 1957 in Laarne, Belgium	http://dbpedia.org/ontology/nationality	http://dbpedia.org/resource/Emly_Starr	http://dbpedia.org/resource/Belgium
269	Álvaro Zamith was a Brazilian sports administrator, who was the first president of the Brazilian Football Confederation	http://dbpedia.org/ontology/nationality	http://dbpedia.org/resource/Álvaro_Zamith	http://dbpedia.org/resource/Brazil
270	Arnaldo Cohen (Rio de Janeiro - 22 April 1948) is a Brazilian	http://dbpedia.org/ontology/nationality	http://dbpedia.org/resource/Arnaldo_Cohen	http://dbpedia.org/resource/Brazil
271	Christina Oiticica (born 23 November 1951 in Rio de Janeiro) is a Brazilian	http://dbpedia.org/ontology/nationality	http://dbpedia.org/resource/Christina_Oiticica	http://dbpedia.org/resource/Brazil
272	Ingrid Antonijevic Hahn (born 22 July 1952) is a Chile	http://dbpedia.org/ontology/nationality	http://dbpedia.org/resource/Ingrid_Antonijevic	http://dbpedia.org/resource/Chile
273	Fazıl Önder was a Turkish Cypriot journalist who fought for peace between communities in Cyprus	http://dbpedia.org/ontology/nationality	http://dbpedia.org/resource/Fazıl_Önder	http://dbpedia.org/resource/Cyprus
274	Domínguez has served as the Attorney General for Dominican Republic	http://dbpedia.org/ontology/nationality	http://dbpedia.org/resource/Francisco_Domínguez_Brito	http://dbpedia.org/resource/Dominican_Republic
275	Anu Vehviläinen (born September 9, 1963 in Leppävirta, Finland	http://dbpedia.org/ontology/nationality	http://dbpedia.org/resource/Anu_Vehviläinen	http://dbpedia.org/resource/Finland
276	Jussi Kristian Halla-aho (born 27 April 1971 in Tampere) is a Finnish Slavic linguist, blogger and a politician for the Finns Party who has become well known for his essays criticising the humanitarian immigration and multiculturalism policies adopted in Finland	http://dbpedia.org/ontology/nationality	http://dbpedia.org/resource/Jussi_Halla-aho	http://dbpedia.org/resource/Finland
277	Schmidt made headlines in 1982 due to his failed attempt to escape from East Germany	http://dbpedia.org/ontology/nationality	http://dbpedia.org/resource/Wolfgang_Schmidt	http://dbpedia.org/resource/Germany
278	Wolfgang Vogel (30 October 1925 – 21 August 2008) was a German lawyer active in East Germany	http://dbpedia.org/ontology/nationality	http://dbpedia.org/resource/Wolfgang_Vogel	http://dbpedia.org/resource/Germany
279	Daniel la Rosa (born October 10, 1985 in Hanau, West Germany	http://dbpedia.org/ontology/nationality	http://dbpedia.org/resource/Daniel_la_Rosa	http://dbpedia.org/resource/Germany
280	Gerd Riss (born 17 March 1965) is a German motorcycle speedway rider who was a member of Germany team	http://dbpedia.org/ontology/nationality	http://dbpedia.org/resource/Gerd_Riss	http://dbpedia.org/resource/Germany
281	Gerd Riss (born 17 March 1965) is a German motorcycle speedway rider who was a member of Germany team at 2001 Speedway World Cup and who was started in Speedway Grand Prix of Germany	http://dbpedia.org/ontology/nationality	http://dbpedia.org/resource/Gerd_Riss	http://dbpedia.org/resource/Germany
282	Jörg Tauss (born 5 July 1953) is a German politician and former member of the Social Democratic Party of Germany	http://dbpedia.org/ontology/nationality	http://dbpedia.org/resource/Jörg_Tauss	http://dbpedia.org/resource/Germany
283	Tauss announced he was leaving the SPD for the Pirate Party Germany	http://dbpedia.org/ontology/nationality	http://dbpedia.org/resource/Jörg_Tauss	http://dbpedia.org/resource/Germany
284	Ross Jamison (born 19 March 1990 in Wales) is a Hong Kong	http://dbpedia.org/ontology/nationality	http://dbpedia.org/resource/Ross_Jamison	http://dbpedia.org/resource/Hong_Kong
285	József Tabaka (born September 17 1989) is a Hungarian motorcycle speedway rider who is a member of Hungary's national team	http://dbpedia.org/ontology/nationality	http://dbpedia.org/resource/József_Tabaka	http://dbpedia.org/resource/Hungary
286	Sindhu holds or has held several prominent BJP party positions including as National Spokesperson, National General Secretary, General Secretary in Haryana, in-charge of Punjab state, and co-in-charge of the state of Uttar Pradesh campaign during the Indian General Election, 2014	http://dbpedia.org/ontology/nationality	http://dbpedia.org/resource/Abhimanyu_Sindhu	http://dbpedia.org/resource/India
287	Anubhav Mohanty (Odia: ଅନୁଭବ ମହାନ୍ତି; born 24 December 1981) is an Ollywood and Bengali actor and politician in the state of Odisha in India	http://dbpedia.org/ontology/nationality	http://dbpedia.org/resource/Anubhav_Mohanty	http://dbpedia.org/resource/India
288	Arpita Chatterjee (née Pal) is an India	http://dbpedia.org/ontology/nationality	http://dbpedia.org/resource/Arpita_Pal	http://dbpedia.org/resource/India
289	Cyriac Joseph (born on 28 January 1947 at Kaipuzha, Kottayam District, Travancore) was a Judge of the Supreme Court of India	http://dbpedia.org/ontology/nationality	http://dbpedia.org/resource/Cyriac_Joseph	http://dbpedia.org/resource/India
290	Debi Prasad Pal is a Senior Advocate practicing in the Supreme Court of India	http://dbpedia.org/ontology/nationality	http://dbpedia.org/resource/Debi_Prasad_Pal	http://dbpedia.org/resource/India
291	Debi Prasad Pal is a Senior Advocate practicing in the Supreme Court of India and High Courts of India	http://dbpedia.org/ontology/nationality	http://dbpedia.org/resource/Debi_Prasad_Pal	http://dbpedia.org/resource/India
292	Digvijay Singh (born 30 January 1972) is a professional golfer from India currently playing on the Professional Golf Tour of India	http://dbpedia.org/ontology/nationality	http://dbpedia.org/resource/Digvijay_Singh_(golfer)	http://dbpedia.org/resource/India
293	Singh was born in New Delhi to an Indian Army	http://dbpedia.org/ontology/nationality	http://dbpedia.org/resource/Digvijay_Singh_(golfer)	http://dbpedia.org/resource/India
294	Digvijay Singh (born 30 January 1972) is a professional golfer from India	http://dbpedia.org/ontology/nationality	http://dbpedia.org/resource/Digvijay_Singh_(golfer)	http://dbpedia.org/resource/India
295	M. B. Nirmal is the founder and chairman of Exnora International which is a civic movement in Chennai, Tamil Nadu, India	http://dbpedia.org/ontology/nationality	http://dbpedia.org/resource/M._B._Nirmal	http://dbpedia.org/resource/India
296	Mahabal Mishra was a Member of Parliament of India	http://dbpedia.org/ontology/nationality	http://dbpedia.org/resource/Mahabal_Mishra	http://dbpedia.org/resource/India
297	Nitish Mishra (born 9 July 1973) is an India	http://dbpedia.org/ontology/nationality	http://dbpedia.org/resource/Nitish_Mishra	http://dbpedia.org/resource/India
298	Ramasubbu's father S.Sudalaimuthu Nadar was active for the Indian National Congress	http://dbpedia.org/ontology/nationality	http://dbpedia.org/resource/S._S._Ramasubbu	http://dbpedia.org/resource/India
299	Revo became the source person for the story, representing Indonesian Wikipedia	http://dbpedia.org/ontology/nationality	http://dbpedia.org/resource/Revo_Soekatno	http://dbpedia.org/resource/Indonesia
300	Revo Arka Giri Soekatno (Ambon, Indonesia	http://dbpedia.org/ontology/nationality	http://dbpedia.org/resource/Revo_Soekatno	http://dbpedia.org/resource/Indonesia
301	Max Amini (Persian: مکس امینی) born in Tucson, Arizona is an Iranian American	http://dbpedia.org/ontology/nationality	http://dbpedia.org/resource/Max_Amini	http://dbpedia.org/resource/Iran
302	Andrea Maida (born 23 March 1964 in Loreo, Rovigo Italy) is a former Italian motorcycle speedway rider who is a member of Italy's national team	http://dbpedia.org/ontology/nationality	http://dbpedia.org/resource/Andrea_Maida	http://dbpedia.org/resource/Italy
303	Alberto Broggi is General Manager at VisLab srl (spinoff of the University of Parma acquired by Silicon-Valley company Ambarella Inc. on June 2015) and a professor of Computer Engineeringat the University of Parma in Italy	http://dbpedia.org/ontology/nationality	http://dbpedia.org/resource/Alberto_Broggi	http://dbpedia.org/resource/Italy
304	Daniela Benedini (born May 24, 1972 in Desio, Italy	http://dbpedia.org/ontology/nationality	http://dbpedia.org/resource/Daniela_Benedini	http://dbpedia.org/resource/Italy
305	Luna was born in Rome, Italy	http://dbpedia.org/ontology/nationality	http://dbpedia.org/resource/Diana_Luna	http://dbpedia.org/resource/Italy
306	Diana Luna (born 3 September 1982) is a professional golfer from Italy	http://dbpedia.org/ontology/nationality	http://dbpedia.org/resource/Diana_Luna	http://dbpedia.org/resource/Italy
307	Irie played on the Japan Golf Tour	http://dbpedia.org/ontology/nationality	http://dbpedia.org/resource/Tsutomu_Irie	http://dbpedia.org/resource/Japan
308	Ōyokota was born in Hiroshima Prefecture, Japan	http://dbpedia.org/ontology/nationality	http://dbpedia.org/resource/Tsutomu_Ōyokota	http://dbpedia.org/resource/Japan
309	Yano has won three tournaments on the Japan Golf Tour	http://dbpedia.org/ontology/nationality	http://dbpedia.org/resource/Azuma_Yano	http://dbpedia.org/resource/Japan
310	Daisuke Hosokawa (細川 大輔 Hosokawa Daisuke) (born April 18, 1982 in Amagasaki, Hyōgo) is a Japanese	http://dbpedia.org/ontology/nationality	http://dbpedia.org/resource/Daisuke_Hosokawa	http://dbpedia.org/resource/Japan
311	Junya Koga (古賀 淳也 Koga Junya, born July 19, 1987 in Kumagaya, Saitama) is a Japanese	http://dbpedia.org/ontology/nationality	http://dbpedia.org/resource/Junya_Koga	http://dbpedia.org/resource/Japan
312	Algimantas Sakalauskas (September 22, 1958 in Dailučiai, Lithuania	http://dbpedia.org/ontology/nationality	http://dbpedia.org/resource/Algimantas_Sakalauskas	http://dbpedia.org/resource/Lithuania
313	Sakalauskas participated in internationals wood carvers symposiums and exhibitions in Lithuania	http://dbpedia.org/ontology/nationality	http://dbpedia.org/resource/Algimantas_Sakalauskas	http://dbpedia.org/resource/Lithuania
314	Dokšaitė has held personal exhibitions at various galleries, including the Kawamura Memorial Art Museum in Japan and the exhibition gallery of the Lithuanian Seimas	http://dbpedia.org/ontology/nationality	http://dbpedia.org/resource/Dalia_Dokšaitė	http://dbpedia.org/resource/Lithuania
315	Bady Minck (born in Ettelbruck, Luxembourg	http://dbpedia.org/ontology/nationality	http://dbpedia.org/resource/Bady_Minck	http://dbpedia.org/resource/Luxembourg
316	Mohammed Benzakour (born 10 January 1972 in Nador, Morocco	http://dbpedia.org/ontology/nationality	http://dbpedia.org/resource/Mohammed_Benzakour	http://dbpedia.org/resource/Morocco
317	Dominick Muermans (born July 17, 1984 in Geleen, Netherlands	http://dbpedia.org/ontology/nationality	http://dbpedia.org/resource/Dominick_Muermans	http://dbpedia.org/resource/Netherlands
318	Roethof worked at the Dutch Ministry of Foreign Affairs, until he was elected as a PvdA MP in the House of Representatives of the Netherlands	http://dbpedia.org/ontology/nationality	http://dbpedia.org/resource/Hein_Roethof	http://dbpedia.org/resource/Netherlands
319	Stassen announced that she had joined the party For the Netherlands	http://dbpedia.org/ontology/nationality	http://dbpedia.org/resource/Laurence_Stassen	http://dbpedia.org/resource/Netherlands
320	Bent Stiansen (born June 18, 1963 in Arendal, Norway	http://dbpedia.org/ontology/nationality	http://dbpedia.org/resource/Bent_Stiansen	http://dbpedia.org/resource/Norway
321	Teodoro Jr. PLH (born on June 14, 1964 in Isabela, Philippines	http://dbpedia.org/ontology/nationality	http://dbpedia.org/resource/Gilbert_Teodoro	http://dbpedia.org/resource/Philippines
322	Teodoro Jr. PLH (born on June 14, 1964 in Isabela, Philippines	http://dbpedia.org/ontology/nationality	http://dbpedia.org/resource/Gilbert_Teodoro	http://dbpedia.org/resource/Philippines
323	Tan to serve as the next chancellor of the University of the Philippines Diliman	http://dbpedia.org/ontology/nationality	http://dbpedia.org/resource/Michael_Tan	http://dbpedia.org/resource/Philippines
324	Michael Lim Tan, DVM, PhD (born 1952) is a Filipino medical anthropologist, writer, and academic who is the current Chancellor of the University of the Philippines Diliman	http://dbpedia.org/ontology/nationality	http://dbpedia.org/resource/Michael_Tan	http://dbpedia.org/resource/Philippines
325	Tan was already well known for his work among Non-governmental organizations in the Philippines	http://dbpedia.org/ontology/nationality	http://dbpedia.org/resource/Michael_Tan	http://dbpedia.org/resource/Philippines
326	Alicja Fiodorow (born 22 May 1985) is a Paralympic athlete from Poland	http://dbpedia.org/ontology/nationality	http://dbpedia.org/resource/Alicja_Fiodorow	http://dbpedia.org/resource/Poland
327	Pedro Petiz (born October 29, 1986 in Porto, Portugal	http://dbpedia.org/ontology/nationality	http://dbpedia.org/resource/Pedro_Petiz	http://dbpedia.org/resource/Portugal
328	María Eloisa Meléndez Altieri (born 1950), also known as Mayita, is the current mayor of the city of Ponce, Puerto Rico	http://dbpedia.org/ontology/nationality	http://dbpedia.org/resource/María_Meléndez	http://dbpedia.org/resource/Puerto_Rico
329	Yuri Dmitrievich Burago (Russian	http://dbpedia.org/ontology/nationality	http://dbpedia.org/resource/Yuri_Burago	http://dbpedia.org/resource/Russia
330	Alexander Vladimirovich Mazin (Russian	http://dbpedia.org/ontology/nationality	http://dbpedia.org/resource/Alexander_Mazin	http://dbpedia.org/resource/Russia
331	Maria Vitalyevna Verchenova (Russian	http://dbpedia.org/ontology/nationality	http://dbpedia.org/resource/Maria_Verchenova	http://dbpedia.org/resource/Russia
332	Zaitsev (Russian: Вячеслав Михайлович Зайцев), more commonly known as Slava Zaitsev (Russian:  Слава Зайцев), born 2 March 1938 in Ivanovo, Russian Soviet Federative Socialist Republic	http://dbpedia.org/ontology/nationality	http://dbpedia.org/resource/Slava_Zaitsev	http://dbpedia.org/resource/Russia
333	Zaitsev (Russian	http://dbpedia.org/ontology/nationality	http://dbpedia.org/resource/Slava_Zaitsev	http://dbpedia.org/resource/Russia
334	Zaitsev (Russian	http://dbpedia.org/ontology/nationality	http://dbpedia.org/resource/Slava_Zaitsev	http://dbpedia.org/resource/Russia
