id	text	property	subject	object
107	Velda graduated from P.S. DuPont High School in Wilmington and went on to the University of Delaware for her undergraduate degree; she then obtained an MBA from Indiana University	http://dbpedia.org/ontology/almaMater	http://dbpedia.org/resource/Velda_Jones-Potter	http://dbpedia.org/resource/Indiana_University
108	Kruse graduated from the School of Education at Indiana University	http://dbpedia.org/ontology/almaMater	http://dbpedia.org/resource/Dennis_Kruse	http://dbpedia.org/resource/Indiana_University
109	Sellers attended Cranbrook School, Cranbrook, Kent, United Kingdom, until 1973, and achieved a bachelor's degree in ecological science from the University of Edinburgh	http://dbpedia.org/ontology/almaMater	http://dbpedia.org/resource/Piers_Sellers	http://dbpedia.org/resource/University_of_Edinburgh
110	Hata graduated from Seijo University	http://dbpedia.org/ontology/almaMater	http://dbpedia.org/resource/Tsutomu_Hata	http://dbpedia.org/resource/Seijo_University
111	Jain graduated from Barnard College	http://dbpedia.org/ontology/almaMater	http://dbpedia.org/resource/Anjli_Jain	http://dbpedia.org/resource/Barnard_College
112	Jain graduated from Barnard College	http://dbpedia.org/ontology/almaMater	http://dbpedia.org/resource/Anjli_Jain	http://dbpedia.org/resource/Barnard_College
113	Liebowitz received his undergraduate degree from Bucknell University in 1979 and completed his postgraduate work at Columbia University	http://dbpedia.org/ontology/almaMater	http://dbpedia.org/resource/Ronald_D._Liebowitz	http://dbpedia.org/resource/Columbia_University
114	Jain graduated from Barnard College of Columbia University	http://dbpedia.org/ontology/almaMater	http://dbpedia.org/resource/Anjli_Jain	http://dbpedia.org/resource/Columbia_University
115	Jain graduated from Barnard College of Columbia University	http://dbpedia.org/ontology/almaMater	http://dbpedia.org/resource/Anjli_Jain	http://dbpedia.org/resource/Columbia_University
116	Philip J. Hanlon (born 1955) is an American mathematician, computer scientist, and educator who serves as the 18th President of his alma mater, Dartmouth College	http://dbpedia.org/ontology/almaMater	http://dbpedia.org/resource/Philip_J._Hanlon	http://dbpedia.org/resource/Dartmouth_College
117	Witt received his bachelor's degree in economics in 1962 from Bates College, his M.B.A. from Dartmouth College	http://dbpedia.org/ontology/almaMater	http://dbpedia.org/resource/Robert_Witt_(American_academic)	http://dbpedia.org/resource/Dartmouth_College
118	Thomas is a graduate of Iowa State University	http://dbpedia.org/ontology/almaMater	http://dbpedia.org/resource/Adrienne_Thomas	http://dbpedia.org/resource/Iowa_State_University
119	Winograd studied Electrical Engineering at the Massachusetts Institute of Technology	http://dbpedia.org/ontology/almaMater	http://dbpedia.org/resource/Shmuel_Winograd	http://dbpedia.org/resource/Massachusetts_Institute_of_Technology
120	Sarbanes is a graduate of Princeton University	http://dbpedia.org/ontology/almaMater	http://dbpedia.org/resource/Paul_Sarbanes	http://dbpedia.org/resource/Princeton_University
121	Sotomayor graduated summa cum laude from Princeton University	http://dbpedia.org/ontology/almaMater	http://dbpedia.org/resource/Sonia_Sotomayor	http://dbpedia.org/resource/Princeton_University
122	Stonebraker earned his bachelor's degree from Princeton University	http://dbpedia.org/ontology/almaMater	http://dbpedia.org/resource/Michael_Stonebraker	http://dbpedia.org/resource/Princeton_University
123	Pauling was educated at Drummoyne Boys' High School, and graduated with a Bachelor of Laws (LLB) from the Sydney Law School	http://dbpedia.org/ontology/almaMater	http://dbpedia.org/resource/Tom_Pauling	http://dbpedia.org/resource/Sydney_Law_School
124	Liebowitz received his undergraduate degree from Bucknell University	http://dbpedia.org/ontology/almaMater	http://dbpedia.org/resource/Ronald_D._Liebowitz	http://dbpedia.org/resource/Bucknell_University
125	Sullivan earned degrees from Harvard University and Georgetown University	http://dbpedia.org/ontology/almaMater	http://dbpedia.org/resource/Dan_Sullivan_(U.S._Senator)	http://dbpedia.org/resource/Georgetown_University
126	Chopra received his undergraduate degree in public health from the Johns Hopkins University	http://dbpedia.org/ontology/almaMater	http://dbpedia.org/resource/Aneesh_Chopra	http://dbpedia.org/resource/Johns_Hopkins_University
127	Troxler, a resident of Browns Summit, North Carolina, studied conservation at North Carolina State University	http://dbpedia.org/ontology/almaMater	http://dbpedia.org/resource/Steve_Troxler	http://dbpedia.org/resource/North_Carolina_State_University
128	Leigh earned a BA from Tufts University	http://dbpedia.org/ontology/almaMater	http://dbpedia.org/resource/Richard_Leigh_(author)	http://dbpedia.org/resource/Tufts_University
129	Brown is a graduate of Wakefield Memorial High School (1977), Tufts University	http://dbpedia.org/ontology/almaMater	http://dbpedia.org/resource/Scott_Brown_(politician)	http://dbpedia.org/resource/Tufts_University
130	Tacha received a B.A. from the University of Kansas in 1968 and a J.D. from the University of Michigan Law School	http://dbpedia.org/ontology/almaMater	http://dbpedia.org/resource/Deanell_Reece_Tacha	http://dbpedia.org/resource/University_of_Michigan
131	Stonebraker earned his bachelor's degree from Princeton University in 1965 and his master's degree and his Ph.D. from the University of Michigan	http://dbpedia.org/ontology/almaMater	http://dbpedia.org/resource/Michael_Stonebraker	http://dbpedia.org/resource/University_of_Michigan
132	Johnson currently attends the University of Michigan	http://dbpedia.org/ontology/almaMater	http://dbpedia.org/resource/Philip_Johnson_(actor)	http://dbpedia.org/resource/University_of_Michigan
133	Irrgang studied political science at VU University Amsterdam and economics at the University of Amsterdam	http://dbpedia.org/ontology/almaMater	http://dbpedia.org/resource/Ewout_Irrgang	http://dbpedia.org/resource/University_of_Amsterdam
134	Lovink earned his master's degree in political science at the University of Amsterdam	http://dbpedia.org/ontology/almaMater	http://dbpedia.org/resource/Geert_Lovink	http://dbpedia.org/resource/University_of_Amsterdam
135	Tacha received a B.A. from the University of Kansas	http://dbpedia.org/ontology/almaMater	http://dbpedia.org/resource/Deanell_Reece_Tacha	http://dbpedia.org/resource/University_of_Kansas
136	Hill has been on the faculty of the University of Kansas	http://dbpedia.org/ontology/almaMater	http://dbpedia.org/resource/Don_Hill_(politician)	http://dbpedia.org/resource/University_of_Kansas
137	Paul D. Gewirtz (born May 12, 1947) is the Potter Stewart Professor of Constitutional Law at Yale Law School	http://dbpedia.org/ontology/almaMater	http://dbpedia.org/resource/Paul_Gewirtz	http://dbpedia.org/resource/Yale_Law_School
138	Sotomayor graduated summa cum laude from Princeton University in 1976 and received her J.D. from Yale Law School	http://dbpedia.org/ontology/almaMater	http://dbpedia.org/resource/Sonia_Sotomayor	http://dbpedia.org/resource/Yale_Law_School
139	Boyd Jay Petersen (born February 23, 1962) is program coordinator for Mormon Studies at Utah Valley University (UVU) and teaches English and literature at UVU and Brigham Young University	http://dbpedia.org/ontology/almaMater	http://dbpedia.org/resource/Boyd_Petersen	http://dbpedia.org/resource/Brigham_Young_University
140	Red Whittaker is a roboticist and research professor of robotics at Carnegie Mellon University	http://dbpedia.org/ontology/almaMater	http://dbpedia.org/resource/Red_Whittaker	http://dbpedia.org/resource/Carnegie_Mellon_University
