id	text	property	subject	object
87	From 1963 to 1967, Daniel Mora attended the Chorrillos Military School, specialising in engineering.	http://dbpedia.org/ontology/almaMater	http://dbpedia.org/resource/Daniel_Mora	http://dbpedia.org/resource/Chorrillos_Military_School
88	Upon completion of his secondary school, Kayalp graduated with a degree in Mechanical Engineering from Ege University.	http://dbpedia.org/ontology/almaMater	http://dbpedia.org/resource/Oktay_Kayalp	http://dbpedia.org/resource/Ege_University
89	Born and educated in Balıkesir, Babuşcu studied pharmaceutics at Ege University and worked as a pharmacist for ten years.	http://dbpedia.org/ontology/almaMater	http://dbpedia.org/resource/Tülay_Babuşcu	http://dbpedia.org/resource/Ege_University
90	McCarthy was born in 1908 in the Town of Grand Chute in Outagamie County, Wisconsin, and attended Marquette University, studying different subjects before deciding on law and earning an LL.B. from Marquette University Law School.	http://dbpedia.org/ontology/almaMater	http://dbpedia.org/resource/Joseph_McCarthy	http://dbpedia.org/resource/Marquette_University_Law_School
91	Goyke is a graduate of St. John's University (Minnesota) (B.A. in political science, 2005) and Marquette University Law School (J.	http://dbpedia.org/ontology/almaMater	http://dbpedia.org/resource/Evan_Goyke	http://dbpedia.org/resource/Marquette_University_Law_School
92	Born in Chicago, Illinois, Doyne received his bachelor's degree from Marquette University and then received his law degree from the Marquette University Law School.	http://dbpedia.org/ontology/almaMater	http://dbpedia.org/resource/John_Doyne	http://dbpedia.org/resource/Marquette_University_Law_School
93	Ziegler received a Bachelor of Arts degree in Business Administration and Psychology from Hope College, and a law degree from Marquette University Law School.	http://dbpedia.org/ontology/almaMater	http://dbpedia.org/resource/Annette_Ziegler	http://dbpedia.org/resource/Marquette_University_Law_School
94	Born in Jacksonville, Florida, Ackerman received a Bachelor of Science from Marquette University in 1947 and a Juris Doctorate from Marquette University Law School in 1949.	http://dbpedia.org/ontology/almaMater	http://dbpedia.org/resource/James_Waldo_Ackerman	http://dbpedia.org/resource/Marquette_University_Law_School
95	Born in Milwaukee, Wisconsin, Griesbach received a B.A. from Marquette University in 1976 and a J.D. from Marquette University Law School in 1979.	http://dbpedia.org/ontology/almaMater	http://dbpedia.org/resource/William_C._Griesbach	http://dbpedia.org/resource/Marquette_University_Law_School
96	Brown graduated from Narbonne High School (Class of 1979) in Los Angeles' Harbor City neighborhood and earned Bachelor of Arts degrees in Broadcast Journalism and Political Science from the University of Southern California.	http://dbpedia.org/ontology/almaMater	http://dbpedia.org/resource/Marc_Brown_(journalist)	http://dbpedia.org/resource/Narbonne_High_School
97	Delgado-Colon was an Adjunct professor, Pontifical Catholic University of Puerto Rico School of Law from 2003 to 2004.	http://dbpedia.org/ontology/almaMater	http://dbpedia.org/resource/Aida_Delgado-Colon	http://dbpedia.org/resource/Pontifical_Catholic_University_of_Puerto_Rico
98	Bagchi trained in Sanskrit College, Kolkata, the University of Delhi, and the University of Chicago, from where she obtained her PhD in Linguistics, her work spans issues of semantics and syntax in languages in general and South Asian languages in particular, questions of ethics in the application of medical technology and social interaction, and translations of iconic texts in Bangla literature and comparative philology.	http://dbpedia.org/ontology/almaMater	http://dbpedia.org/resource/Tista_Bagchi	http://dbpedia.org/resource/Sanskrit_College
99	Wilkes received his undergraduate degree from the University of South Florida and his Juris Doctor degree from Stetson University College of Law in 1983 and founded the law firm of Wilkes & McHugh, P.A. in 1985.	http://dbpedia.org/ontology/almaMater	http://dbpedia.org/resource/Jim_Wilkes	http://dbpedia.org/resource/Stetson_University_College_of_Law
100	Born in Tampa, Florida, Bucklew received her Bachelor of Arts degree from Florida State University in 1963, her Master of Arts from the University of South Florida in 1968, and her J.D. from the Stetson University College of Law in 1977.	http://dbpedia.org/ontology/almaMater	http://dbpedia.org/resource/Susan_C._Bucklew	http://dbpedia.org/resource/Stetson_University_College_of_Law
101	Maurice Audin (14 February 1932 – after 11 June 1957) was a French mathematics assistant at the University of Algiers, a member of the Algerian Communist Party and an activist in the anticolonialist cause, who was one of the "disappeared" during the Battle of Algiers.	http://dbpedia.org/ontology/almaMater	http://dbpedia.org/resource/Maurice_Audin	http://dbpedia.org/resource/University_of_Algiers
102	Antoaneta Vassileva (in Bulgarian: Антоанета Василева; born 1960) is a Bulgarian economist and Professor of Global Economics and International Economic Relations at the International Economic Relations and Business Department at the University of National and World Economy (UNWE).	http://dbpedia.org/ontology/almaMater	http://dbpedia.org/resource/Antoaneta_Vassileva	http://dbpedia.org/resource/University_of_National_and_World_Economy
103	Vasilev is the recipient of the badge of honor of the University of National and World Economy in Sofia and Doctor Honoris Causa of the "St Ivan Rilski" University of Mining and Geology.	http://dbpedia.org/ontology/almaMater	http://dbpedia.org/resource/Tsvetan_Vasilev	http://dbpedia.org/resource/University_of_National_and_World_Economy
104	Ivan Kostov graduated in Economics from the Karl Marx Higher Institute of Economics (today's University of National and World Economy) in Sofia in 1974, and later earned a Ph.D. in Mathematical Modeling of Economic Processes from Sofia University.	http://dbpedia.org/ontology/almaMater	http://dbpedia.org/resource/Ivan_Kostov	http://dbpedia.org/resource/University_of_National_and_World_Economy
105	Statty Vasilev Stattev (bg.: Стати Василев Статев) is a Bulgarian scientist - economist and mathematician, professor at University of National and World Economy.	http://dbpedia.org/ontology/almaMater	http://dbpedia.org/resource/Statty_Stattev	http://dbpedia.org/resource/University_of_National_and_World_Economy
106	Ostojić graduated from the University of Split's Faculty of Law in 1988.	http://dbpedia.org/ontology/almaMater	http://dbpedia.org/resource/Ranko_Ostojić	http://dbpedia.org/resource/University_of_Split
107	Aghamohammadi has studied in many institutes, including the Ahvaz Jundishapur University of Medical Sciences, Tehran University of Medical Sciences, Great Ormond Street Hospital (Institute of Child Health) and the University of Toyama.	http://dbpedia.org/ontology/almaMater	http://dbpedia.org/resource/Asghar_Aghamohammadi	http://dbpedia.org/resource/Ahvaz_Jundishapur_University_of_Medical_Sciences
108	Doll attended the University of Minnesota, Anoka-Ramsey Community College, and currently attends Normandale Community College.	http://dbpedia.org/ontology/almaMater	http://dbpedia.org/resource/John_P._Doll	http://dbpedia.org/resource/Anoka-Ramsey_Community_College
109	Martiny graduated in 1969 from Archbishop Rummel High School in Metairie and then received his Bachelor of Arts in history in 1973 from Louisiana State University in Baton Rouge.	http://dbpedia.org/ontology/almaMater	http://dbpedia.org/resource/Danny_Martiny	http://dbpedia.org/resource/Archbishop_Rummel_High_School
110	In 1964 Goh furthered her professional training in Australia, as the first Asian to be admitted into the all-white Australian Ballet School.	http://dbpedia.org/ontology/almaMater	http://dbpedia.org/resource/Goh_Soo_Khim	http://dbpedia.org/resource/Australian_Ballet_School
111	Ahliman Tapdiq oğlu Amiraslanov (Azerbaijani: Əhliman Tapdıq oğlu Əmiraslanov; born 1947 in Zod, Armenian SSR) — is an oncologist, a professor and Rector of Azerbaijan Medical University.	http://dbpedia.org/ontology/almaMater	http://dbpedia.org/resource/Ahliman_Amiraslanov	http://dbpedia.org/resource/Azerbaijan_Medical_University
112	Born in Archer City in Archer County, a part of the Wichita Falls metropolitan statistical area, Purcell attended public schools and received his Bachelor of Science from the Agricultural and Mechanical College of Texas in 1946, and his LL.B. in 1949 from Baylor Law School in Waco, Texas.	http://dbpedia.org/ontology/almaMater	http://dbpedia.org/resource/Graham_B._Purcell_Jr.	http://dbpedia.org/resource/Baylor_Law_School
113	In 1952, Tunnell received his law degree from Baptist-affiliated Baylor Law School in Waco and returned to Tyler to become an assistant district attorney before he entered private practice.	http://dbpedia.org/ontology/almaMater	http://dbpedia.org/resource/Byron_M._Tunnell	http://dbpedia.org/resource/Baylor_Law_School
114	On returning to Marshall after World War II, he married Mary Madeleine Segal and graduated with a bachelor's degree from Baylor University in 1946 and an LL.B. from Baylor Law School in 1948.	http://dbpedia.org/ontology/almaMater	http://dbpedia.org/resource/Sam_B._Hall_Jr.	http://dbpedia.org/resource/Baylor_Law_School
115	First elected to the Senate in 1986, he is the Chairman of the United States Senate Committee on Banking, Housing, and Urban Affairs.Born in Birmingham, Alabama, Shelby received his law degree from the Birmingham School of Law in Birmingham, Alabama.	http://dbpedia.org/ontology/almaMater	http://dbpedia.org/resource/Richard_Shelby	http://dbpedia.org/resource/Birmingham_School_of_Law
116	Fehrnstrom graduated in 1984 from Boston University College of Communication.	http://dbpedia.org/ontology/almaMater	http://dbpedia.org/resource/Eric_Fehrnstrom	http://dbpedia.org/resource/Boston_University_College_of_Communication
117	Rosario earned a BFA from NYU’s Tisch School of the Arts and a Master’s degree from the CUNY Graduate School of Journalism and was a 2015 USC Annenberg Health Reporting Fellow.	http://dbpedia.org/ontology/almaMater	http://dbpedia.org/resource/Daisy_Rosario	http://dbpedia.org/resource/CUNY_Graduate_School_of_Journalism
